{
  "schema_version": "trace/v1",
  "relation": "declares",
  "from_ref": {
    "logical_id": "task_run:9f2c9c2e-6b4b-4d0a-9a3d-6a2f7a1c9e10"
  },
  "to_ref": {
    "logical_id": "spec.md",
    "content_digest": "sha256:cccccccccccccccccccccccccccccccccccccccccccccccccccccccccccccccc"
  },
  "occurred_at": "2026-08-01T14:00:00Z",
  "actor": {
    "kind": "human"
  },
  "task_run_id": "9f2c9c2e-6b4b-4d0a-9a3d-6a2f7a1c9e10",
  "lane_id": "lane-42",
  "supersedes_event_id": "tr1_c31907319c714d5fd63ffbb9cef41fa369b7dc60da04ddb94fdd791ecf02ec9e",
  "event_id": "tr1_a2b261e681012813bd8ba2933047177879e4b190a982b4c7667c8310d5f3ef0f"
}
