{
  "schema_version": "trace/v1",
  "relation": "declares",
  "from_ref": {
    "logical_id": "task_run:9f2c9c2e-6b4b-4d0a-9a3d-6a2f7a1c9e10"
  },
  "to_ref": {
    "logical_id": "decision.yaml",
    "content_digest": "sha256:dddddddddddddddddddddddddddddddddddddddddddddddddddddddddddddddd"
  },
  "occurred_at": "2026-08-02T09:00:00Z",
  "actor": {
    "kind": "human"
  },
  "task_run_id": "9f2c9c2e-6b4b-4d0a-9a3d-6a2f7a1c9e10",
  "lane_id": "lane-42",
  "supersedes_event_id": "tr1_0000000000000000000000000000000000000000000000000000000000000000",
  "event_id": "tr1_226b3105bff3e04cc82e94f822d9de0dab31c3129f490a95f6ab82452232304f"
}
